Title,Content,Published At,Source,URL,Category
Неизвестные устроили драку со стрельбой в центре Екатеринбурга. ,"Неизвестные устроили драку со стрельбой в центре Екатеринбурга. 

По словам очевидцев, они обедали на веранде, когда услышали выстрелы. После этого посетители забежали внутрь ресторана в ЖК «Тихвин». В это время на улице началась драка, на место съехались машины. При этом участники потасовки успели скрыться до приезда полиции, задержаний не проводилось.

Очевидцы утверждают, что одному мужчине выстрелили из травматического пистолета в ногу, другому пуля попала в грудь. Как рассказывают очевидцы, группу этих мужчин ранее часто видели в тех же ресторанах элитного комплекса, у которого они подрались.",2024-06-26T09:39:40+00:00,"Осторожно, новости",https://t.me/ostorozhno_novosti/27211,
No Title,,2024-06-26T09:04:38+00:00,"Осторожно, новости",https://t.me/ostorozhno_novosti/27210,
No Title,,2024-06-26T09:04:38+00:00,"Осторожно, новости",https://t.me/ostorozhno_novosti/27209,
No Title,,2024-06-26T09:04:38+00:00,"Осторожно, новости",https://t.me/ostorozhno_novosti/27208,
No Title,,2024-06-26T09:04:38+00:00,"Осторожно, новости",https://t.me/ostorozhno_novosti/27207,
"В Дербенте проходит отпевание отца Николая, убитого террористами во время атаки на храм. ","В Дербенте проходит отпевание отца Николая, убитого террористами во время атаки на храм. 

По словам корреспондента ""Осторожно, новости"", улицы вокруг церкви Покрова Пресвятой Богородицы оцеплены. Вокруг много вооруженных силовиков и полицейских, всех посетителей тщательно проверяют на входе. Людей на отпевание пришло много: церковь заполнена полностью, среди скорбящих представители разных конфессий, включая мусульман и иудеев. Сегодня в Дербенте также активно проверяют авто, силовики на авто патрулируют город и останавливают некоторые машины с помощью громкоговорителей.

Погибшему протоиерею Николаю Котельникову было 66 лет, 44 года из них он прослужил в храме Покрова Пресвятой Богородицы, преподавал в воскресной школе, участвовал в миссии по привозу Благодатного огня из Иерусалима. У священника остались жена, трое детей и внуков. Накануне Путин посмертно наградил отца Николая орденом Мужества.",2024-06-26T09:04:38+00:00,"Осторожно, новости",https://t.me/ostorozhno_novosti/27206,
«Я спрашивал наших коллег в Европейском суде: как вы полагаете разрешить эти митинги в Грозном или Махачкале? Их там живыми оставят или нет?»,"«Я спрашивал наших коллег в Европейском суде: как вы полагаете разрешить эти митинги в Грозном или Махачкале? Их там живыми оставят или нет?»

Председатель Конституционного суда объяснил, что законы о запрете пропаганды ЛГБТ* частично связаны с «социальным состоянием» в мусульманских регионах России.

Валерий Зорькин на конференции в Конституционном суде в Санкт-Петербурге (в эти даты в городе проходит юридический форум) рассказал, что в России был принят закон о запрете пропаганды ЛГБТ* среди несовершеннолетних и по этому поводу были претензии со стороны ЕСПЧ — также там спрашивали, почему в стране не разрешают шествия представителей меньшинств. 

На это Зорькин ответил, что в суде не учитывают позицию регионов России: так, по его мнению, в Чечне или Дагестане проведение парадов было бы попросту невозможно.

*движение признано экстремистским и запрещено в РФ",2024-06-26T08:00:00+00:00,"Осторожно, новости",https://t.me/ostorozhno_novosti/27205,
"«Не шутите так, пацаны. Моя шутка меня сюда привела”.","«Не шутите так, пацаны. Моя шутка меня сюда привела”.

Связанный с пресс-службой МВД Дагестана канал сообщает, что причиной вечерней операции силовиков стала “шутка” местного жителя.

Телеграм-канал “Криминальная хроника” опубликовал видео допроса 27-летнего жителя Махачкалы, которого задержали по следам оцепления на Университетской набережной. По словам мужчины, он сказал компании незнакомых женщин, что “сейчас опасное время выходить”, и “всякое происходит короче”. Девушки не оценили юмор, и “не так донесли полиции” о случившемся. «Честно, первый и последний раз в жизни. Не шутите так, пацаны, или кто бы там не было. Моя шутка меня привела сюда», — резюмирует мужчина. 

Тг-канал также приводит версию 17-летней заявительницы. Она сидела с подругами в кофейне, когда рядом припарковался внедорожник, из которого вышли трое незнакомцев. Мужчина на видео подошел к девушкам сзади и сказал: “Смывайтесь отсюда, сейчас здесь будет перестрелка!”. Они покинули площадь, сообщив о произошедшем в органы. Сразу же на место выехали семь нарядов полиции с кинологами, а затем, не обнаружив угрозы, задержали махачкалинца.",2024-06-25T23:49:14+00:00,"Осторожно, новости",https://t.me/ostorozhno_novosti/27204,
МВД Дагестана официально опровергло стрельбу в Махачкале и нападение на сотрудников полиции.,"МВД Дагестана официально опровергло стрельбу в Махачкале и нападение на сотрудников полиции.

В ведомстве сообщили, что сотрудники проверили территорию Университетской площади по поступившему от очевидца заявлению о вооруженном человеке. Информация не подтвердилась. Данные про “двух вооружённых людей, открывших огонь по сотруднику ППС”, которую распространил государственный тг-канал Shot, оказались фейковыми.

“Поступило сообщение от очевидца о том, что он ""увидел в районе Университетской площади вооруженного человека"".На место незамедлительно было направлено несколько нарядов полиции, территория оцеплена. Проведена тщательная проверка площади и окружающей её территории. С привлечением кинологов. Информация не подтвердилась. Всё спокойно. Команда - отбой”, — сообщили в пресс-службе ведомства.",2024-06-25T20:08:47+00:00,"Осторожно, новости",https://t.me/ostorozhno_novosti/27203,
"Дагестанские тг-каналы  (""Спросите у Расула"", ""Что там у дагестанцев"") пишут, что сообщения о стрельбе в Махачкале не подтверждаются — по их данным, причиной полицейского оцепления стало анонимное сообщение о подозрительном авто.","Дагестанские тг-каналы  (""Спросите у Расула"", ""Что там у дагестанцев"") пишут, что сообщения о стрельбе в Махачкале не подтверждаются — по их данным, причиной полицейского оцепления стало анонимное сообщение о подозрительном авто.

Также в МВД сообщили, что в городе не вводился план ""Перехват"", о котором сообщил тг-канал Shot",2024-06-25T20:01:20+00:00,"Осторожно, новости",https://t.me/ostorozhno_novosti/27202,
"""Не кучковаться!""","""Не кучковаться!""

Силовики в районе Университетской площади в центре Махачкалы отгоняют очевидцев и прочесывают территорию.",2024-06-25T19:57:53+00:00,"Осторожно, новости",https://t.me/ostorozhno_novosti/27201,
Работа силовиков в центре Махачкалы,Работа силовиков в центре Махачкалы,2024-06-25T19:53:27+00:00,"Осторожно, новости",https://t.me/ostorozhno_novosti/27200,
"В админстрации Махачкалы сообщили, что в районе улиц Магомеда Гаджиева и Коркмасова силовики ""проводят мероприятия и предупреждают население о необходимости покинуть эту территорию"".","В админстрации Махачкалы сообщили, что в районе улиц Магомеда Гаджиева и Коркмасова силовики ""проводят мероприятия и предупреждают население о необходимости покинуть эту территорию"".

Власти города просят воздержаться от поездок в эту часть города .",2024-06-25T19:50:28+00:00,"Осторожно, новости",https://t.me/ostorozhno_novosti/27199,
"По предвариительной информации, в Махачкале идет спецоперация силовиков.","По предвариительной информации, в Махачкале идет спецоперация силовиков.

Сотрудники полиции просят очевидцев покинуть район, где сообщали о звуках стрельбы.",2024-06-25T19:46:36+00:00,"Осторожно, новости",https://t.me/ostorozhno_novosti/27198,
Университетская площадь в Махачкале,Университетская площадь в Махачкале,2024-06-25T19:43:25+00:00,"Осторожно, новости",https://t.me/ostorozhno_novosti/27197,
Жители Махачкалы сообщают о звуках стрельбы в районе улицы Коркмасова. Официальных комментариев пока не поступало.,Жители Махачкалы сообщают о звуках стрельбы в районе улицы Коркмасова. Официальных комментариев пока не поступало.,2024-06-25T19:39:15+00:00,"Осторожно, новости",https://t.me/ostorozhno_novosti/27196,
No Title,,2024-06-25T17:54:51+00:00,"Осторожно, новости",https://t.me/ostorozhno_novosti/27195,
No Title,,2024-06-25T17:54:51+00:00,"Осторожно, новости",https://t.me/ostorozhno_novosti/27194,
No Title,,2024-06-25T17:54:51+00:00,"Осторожно, новости",https://t.me/ostorozhno_novosti/27193,
No Title,,2024-06-25T17:54:51+00:00,"Осторожно, новости",https://t.me/ostorozhno_novosti/27192,
No Title,,2024-06-25T17:54:51+00:00,"Осторожно, новости",https://t.me/ostorozhno_novosti/27191,
No Title,,2024-06-25T17:54:51+00:00,"Осторожно, новости",https://t.me/ostorozhno_novosti/27190,
No Title,,2024-06-25T17:54:51+00:00,"Осторожно, новости",https://t.me/ostorozhno_novosti/27189,
No Title,,2024-06-25T17:54:51+00:00,"Осторожно, новости",https://t.me/ostorozhno_novosti/27188,
No Title,,2024-06-25T17:54:51+00:00,"Осторожно, новости",https://t.me/ostorozhno_novosti/27187,
«Хватит тратить людей и деньги на войну».,"«Хватит тратить людей и деньги на войну».

Людмила Васильева — единственный антивоенный кандидат в губернаторы Санкт-Петербурга, который до 29 июня собирает подписи в свою поддержку. Ей 83 года, она пережила блокаду Ленинграда, ходила на митинги Навального и сейчас занимается политикой, открыто выступая против боевых действий. 

По поводу своего возраста Людмила Николаевна не переживает, ведь считает, что «хуже Беглова представить трудно». «Осторожно, новости» поговорили с Васильевой и узнали, почему она не боится заниматься политикой.",2024-06-25T17:54:51+00:00,"Осторожно, новости",https://t.me/ostorozhno_novosti/27186,
Сын дагестанского экс-чиновника нанес жене 16 ножевых ранений из-за её «аморального поведения».,"Сын дагестанского экс-чиновника нанес жене 16 ножевых ранений из-за её «аморального поведения».

Суд не стал отправлять его в СИЗО.

31-летний Пирбудаг Гаджимагомедов в апреле напал с ножом на свою супругу и нанёс ей 16 ранений — в это время их дети были в соседней комнате. После этого мужчина оставил супругу истекать кровью и скрылся, женщину спасла её мать. «В результате многочисленных ранений у потерпевшей повреждены почти все жизненно важные органы: легкие, грудь, печень, желудок, поджелудочная железа, кишка, конечности», — отмечал адвокат пострадавшей. Гаджимагомедов находился в розыске 12 дней, после чего якобы явился с повинной и его отправили под домашний арест по делу о нанесении тяжких телесных повреждений.

Адвокат пострадавшей женщины обжаловал решение и указал, что Пирбудаг знает, где она живёт, и может принудить её заявить об отсутствии претензий. Так, до задержания он давил на родственников пострадавшей, и рассказывал подробности интимной жизни семьи, когда женщина была в больнице в тяжёлом состоянии. Представитель Гаджимагомедова в свою очередь заявил, что мужчина в момент преступления находился «в состоянии сильного душевного волнения», которое якобы вызвало «аморальное поведение» жены. Суд встал на его сторону и не стал отправлять мужчину в СИЗО. Фигаурант дела — сын дагестанского экс-чиновника Абдурахмангаджи Гаджимагомедова, в разные годы он занимал должности гендиректора местной «Роспечати», первого зампредседателя Комитета по развитию малого и среднего предпринимательства Дагестана и замруководителя республиканской службы по тарифам.",2024-06-25T16:47:39+00:00,"Осторожно, новости",https://t.me/ostorozhno_novosti/27185,
"«Welcome to Мариуполь, Бердянск — базированные русские города. Мы их за два года почистили от говна». ","«Welcome to Мариуполь, Бердянск — базированные русские города. Мы их за два года почистили от говна». 

Военный летчик и Z-блогер Алексей Воевода сообщил на стриме, что отправил “на подвал” жительницу Бердянска — за то, что она говорила по-украински. 

Признание военнослужащего прозвучало на стриме его коллеги Z-блогера Кирилла Федорова. Воевода говорил о недавнем ракетном ударе по пляжу в Севастополе и посоветовал россиянам съездить на “новые территории” — в “базированные русские города” Бердянск и Мариуполь. 

Летчик заявил, что населенные пункты “почистили от говна хохлятского” и вспомнил историю, как сам был в Бердянске, купил себе немецкий Mercedes и остановился на бензоколонке заправиться. Работавшая там девушка по-украински сказала ему “Прикладывайте карту”. В ответ Воевода пожаловался на незнакомку ближайшему блокпосту, после чего ее отправили в подвал. Рассказав историю, Воевода рассмеялся, а его соведущий поспешил сменить тему и стал отвечать на вопросы зрителей.",2024-06-25T15:31:00+00:00,"Осторожно, новости",https://t.me/ostorozhno_novosti/27184,
Израиль отменил освобождение от воинской службы для евреев-ультраортодоксов. ,"Израиль отменил освобождение от воинской службы для евреев-ультраортодоксов. 

По закону все израильтяне обязаны пойти на службу с 18 лет: на три года мужчины и на два года — женщины. При этом студенты йешив (особые религиозные учреждения, где изучают Тору) имели освобождение от службы с 1949 года. Они представляют сообщество ультраортодоксальных евреев (харедим), которое выступает против службы в армии, слабо вовлечено в экономику и во многом полагается на государственные дотации (при этом составляет до 13% населения страны). Вопрос отсрочки был причиной многолетних споров израильтян: светские евреи часто говорили, что на их плечи ложится слишком много обязанностей, которые игнорируются ультраортодоксами. После вторжения ХАМАС дискуссии обострились. Начались протесты светских иудеев, недовольных тем, что они берут на себя все риски войны. 

Эти настроения поддержали министр обороны Йоав Галант, лидер оппозиции Яир Лапид и член военного кабинета Бенни Ганц. При этом закон, освобождающий семинаристов от призыва, перестал действовать ещё в 2017 году. В последние годы правое правительство Израиля, которое опирается на консервативную прослойку общества, продлевало его специальными указами. Теперь Верховный суд постановил, что государство обязано призывать студентов ортодоксальных учебных заведений в армию.

«Нет никаких правовых оснований различать ультраортодоксальную молодёжь и всех других израильтян, подлежащих призыву на службу в ЦАХАЛе. Бремя неравенства особенно остро воспринимается сейчас, когда идёт война», — говорится в решении.

Ультраортодоксальные лидеры раскритиковали решение, заявив, что судьи не понимают важности изучения Торы и вклад харедим в жизнь Израиля на протяжении поколений. Лидеры общин грозят правительству массовыми протестами и эмиграцией. Недавно они перекрыли улицы баннером с надписью: «Смерть до призыва в армию».",2024-06-25T14:15:10+00:00,"Осторожно, новости",https://t.me/ostorozhno_novosti/27183,
